,,,,,,Numerode,Casossegun,FechadeIniciodeSintomas
Comuna ,Poblacion ,Numero de Casos Confirmados ,Tasa incidencia acumulada ,Numero de Casos Actuales ,Tasa de Incidencia Actual ,Numero de Casos Activos ,Tasa de Incidencia Activos ,SE SE SE SE SE SE SE SE SE SE SE SE SE 9 10 11 12 13 14 15 16 17 18 19 20 21 
Arica & ,247552 ,477 ,192.7 ,117 ,47.3 ,117 ,47.3 ,O 2 1 2 21 70 63 53 69 50 42 77 27 
Camarones ,1233 ,O ,0.0 ,O ,0.0 ,O ,0.0 ,O O O O O O O O O 0 0 O O 
General Lagos ,810 ,O ,0.0 ,O ,0.0 ,O ,0.0 ,O O O O O O O O O O O O O 
Putre ,2515 ,O ,0.0 ,O ,0.0 ,O ,0.0 ,O O O O O O O O O O O O O 
Total ,252110 ,477 ,189.2 ,117 ,46.4 ,117 ,46.4 ,0 2 1 2 21 70 63 53 69 50 42 77 27 
